PRODUCT_SKU,PRODUCT_TITLE,WEIGHT,LENGTH,WIDTH,HEIGHT,,,
Ankle_Weight-2kg,2kg Ankle Weight Wrist Power Strap Exercise,,,,,,,"{sku:'Ankle_Weight-2kg',title:'Ankle_Weight-2kg 2kg Ankle Weight Wrist Power Strap Exercise',weight:,l:,w:,h:},"
Clock-PL-2045,30 CM Quartz Black Cat Tail Swinging Clock,,,,,,,"{sku:'Clock-PL-2045',title:'Clock-PL-2045 30 CM Quartz Black Cat Tail Swinging Clock',weight:,l:,w:,h:},"
SCL-300kg,300KGs Digital Price Weight Computing Scale,,,,,,,"{sku:'SCL-300kg',title:'SCL-300kg 300KGs Digital Price Weight Computing Scale',weight:,l:,w:,h:},"
AIRPOT-3L,3L Airpot Thermos Stainless Steel Vacuum Flask Insulated Pump Pot,,,,,,,"{sku:'AIRPOT-3L',title:'AIRPOT-3L 3L Airpot Thermos Stainless Steel Vacuum Flask Insulated Pump Pot',weight:,l:,w:,h:},"
Ladder-2.5+2.5,5 Meter Aluminium Telescopic Ladder,18.05,48,19,95,,,"{sku:'Ladder-2.5+2.5',title:'Ladder-2.5+2.5 5 Meter Aluminium Telescopic Ladder',weight:18.05,l:48,w:19,h:95},"
AquaLife-70L-tank-cabinet,70L Fish Tank Aquarium Curved Glass Filter Pump Light With Cabinet Stand,,,,,,,"{sku:'AquaLife-70L-tank-cabinet',title:'AquaLife-70L-tank-cabinet 70L Fish Tank Aquarium Curved Glass Filter Pump Light With Cabinet Stand',weight:,l:,w:,h:},"
PSSL03-1,Above Ground Swimming Pool Ladder 2 Steps,5.6,70,31,12,,,"{sku:'PSSL03-1',title:'PSSL03-1 Above Ground Swimming Pool Ladder 2 Steps',weight:5.6,l:70,w:31,h:12},"
SitUP-6455,Adjustable Folding Abdominal Sit Up Bench,,,,,,,"{sku:'SitUP-6455',title:'SitUP-6455 Adjustable Folding Abdominal Sit Up Bench',weight:,l:,w:,h:},"
YH-AC61,Air Compressor Electric Tyre Pump Car Bike 4WD Truck Air Bed Inflator 100psi 12V,,,,,,,"{sku:'YH-AC61',title:'YH-AC61 Air Compressor Electric Tyre Pump Car Bike 4WD Truck Air Bed Inflator 100psi 12V',weight:,l:,w:,h:},"
PAC08,Automatic Pool Cleaner Vacuum w/ 10M Hose,6.1,85,18,44,,,"{sku:'PAC08',title:'PAC08 Automatic Pool Cleaner Vacuum w/ 10M Hose',weight:6.1,l:85,w:18,h:44},"
YLT0066-Toilet,Bathroom Vanities Storage Minimalist,,,,,,,"{sku:'YLT0066-Toilet',title:'YLT0066-Toilet Bathroom Vanities Storage Minimalist',weight:,l:,w:,h:},"
Umbrella,Beach Umbrella Outdoor Sun Shade,,,,,,,"{sku:'Umbrella',title:'Umbrella Beach Umbrella Outdoor Sun Shade',weight:,l:,w:,h:},"
YLT0603,Clothes Hanger Stainless Steel Tube Stand,,,,,,,"{sku:'YLT0603',title:'YLT0603 Clothes Hanger Stainless Steel Tube Stand',weight:,l:,w:,h:},"
AquaLife-S500-cabinet,Fish Tank Aquarium Cabinet Stand - 500 x 290 x 625 mm,,,,,,,"{sku:'AquaLife-S500-cabinet',title:'AquaLife-S500-cabinet Fish Tank Aquarium Cabinet Stand - 500 x 290 x 625 mm',weight:,l:,w:,h:},"
Fishing-Landing-Net,Fishing Landing Net Telescopic Aluminium Pole,,,,,,,"{sku:'Fishing-Landing-Net',title:'Fishing-Landing-Net Fishing Landing Net Telescopic Aluminium Pole',weight:,l:,w:,h:},"
sit-up-lwh1008B,FitnessPro Sit Up Bench Free Dumbbells Included,,,,,,,"{sku:'sit-up-lwh1008B',title:'sit-up-lwh1008B FitnessPro Sit Up Bench Free Dumbbells Included',weight:,l:,w:,h:},"
06006-BATHTUB-GREEN,Folding Bath Tub - Newborn Baby |Toddler | Walker- Green,,,,,,,"{sku:'06006-BATHTUB-GREEN',title:'06006-BATHTUB-GREEN Folding Bath Tub - Newborn Baby |Toddler | Walker- Green',weight:,l:,w:,h:},"
06006-BATHTUB-BLUE,Folding Bath Tub - Newborn Baby |Toddler | Walker-Blue,,,,,,,"{sku:'06006-BATHTUB-BLUE',title:'06006-BATHTUB-BLUE Folding Bath Tub - Newborn Baby |Toddler | Walker-Blue',weight:,l:,w:,h:},"
SpeedBall-8312,Freestanding Speed ball Training Punching Ball Boxing Punch Stand,,,,,,,"{sku:'SpeedBall-8312',title:'SpeedBall-8312 Freestanding Speed ball Training Punching Ball Boxing Punch Stand',weight:,l:,w:,h:},"
Uni-Black-24-Inch,Fun Unicycle Circus Bike 24 Inch Black,5.8,60,18.5,62,,,"{sku:'Uni-Black-24-Inch',title:'Uni-Black-24-Inch Fun Unicycle Circus Bike 24 Inch Black',weight:5.8,l:60,w:18.5,h:62},"
Uni-Black-26-Inch,Fun Unicycle Circus Bike 26 Inch Black,6.1,65,19,67,,,"{sku:'Uni-Black-26-Inch',title:'Uni-Black-26-Inch Fun Unicycle Circus Bike 26 Inch Black',weight:6.1,l:65,w:19,h:67},"
GBA01L-Glass-Chess,Glass Chess Set Board Games Home And Office Decor,2.3,39,39,7,,,"{sku:'GBA01L-Glass-Chess',title:'GBA01L-Glass-Chess Glass Chess Set Board Games Home And Office Decor',weight:2.3,l:39,w:39,h:7},"
MasterChef,GrillPro Non-Stick Cast Aluminium BBQ Pan,,,,,,,"{sku:'MasterChef',title:'MasterChef GrillPro Non-Stick Cast Aluminium BBQ Pan',weight:,l:,w:,h:},"
bbq1008,Kettle Trolley Charcoal BBQ Grill Barbecue,3.4,40,29,28,,,"{sku:'bbq1008',title:'bbq1008 Kettle Trolley Charcoal BBQ Grill Barbecue',weight:3.4,l:40,w:29,h:28},"
Clock-N18-black,Large Modern Wall Clock Home Decor Silent Quartz Black | White,3.5,50,50,11,,,"{sku:'Clock-N18-black',title:'Clock-N18-black Large Modern Wall Clock Home Decor Silent Quartz Black | White',weight:3.5,l:50,w:50,h:11},"
WB-NB--90x120,Mobile Whiteboard Magnetic Marker White Board | 90x120cm,,,,,,,"{sku:'WB-NB--90x120',title:'WB-NB--90x120 Mobile Whiteboard Magnetic Marker White Board | 90x120cm',weight:,l:,w:,h:},"
Clock-N20-black,Modern Wall Clock 50cm Large Quartz - Black,4.5,58,55,10,,,"{sku:'Clock-N20-black',title:'Clock-N20-black Modern Wall Clock 50cm Large Quartz - Black',weight:4.5,l:58,w:55,h:10},"
Clock-N20-white,Modern Wall Clock 50cm Large Quartz - White,4.5,58,55,10,,,"{sku:'Clock-N20-white',title:'Clock-N20-white Modern Wall Clock 50cm Large Quartz - White',weight:4.5,l:58,w:55,h:10},"
Ladder-404,Multi PurposeAluminium Folding Ladder - 4.7M,,,,,,,"{sku:'Ladder-404',title:'Ladder-404 Multi PurposeAluminium Folding Ladder - 4.7M',weight:,l:,w:,h:},"
BBQ-BY1021,PortableFolding BBQ Grill Camping Charcoal,,,,,,,"{sku:'BBQ-BY1021',title:'BBQ-BY1021 PortableFolding BBQ Grill Camping Charcoal',weight:,l:,w:,h:},"
Clock-14410Black,Quartz Large Metal Wall Clock Black Silent,2.5,39,36,8,,,"{sku:'Clock-14410Black',title:'Clock-14410Black Quartz Large Metal Wall Clock Black Silent',weight:2.5,l:39,w:36,h:8},"
Clock-PL804,Quartz Large Roman Retro Silent Wall Clock,,,,,,,"{sku:'Clock-PL804',title:'Clock-PL804 Quartz Large Roman Retro Silent Wall Clock',weight:,l:,w:,h:},"
DBL-Pan-32cm,Schaffer Double Pan,,,,,,,"{sku:'DBL-Pan-32cm',title:'DBL-Pan-32cm Schaffer Double Pan',weight:,l:,w:,h:},"
Clock-Pl4007,Submariner Wall Clock Chrome Steel Sport Designer Home Decor,,,,,,,"{sku:'Clock-Pl4007',title:'Clock-Pl4007 Submariner Wall Clock Chrome Steel Sport Designer Home Decor',weight:,l:,w:,h:},"
PHR-1001,Swimming Pool Cleaner Hose Reel Caddy,3,49,15,50,,,"{sku:'PHR-1001',title:'PHR-1001 Swimming Pool Cleaner Hose Reel Caddy',weight:3,l:49,w:15,h:50},"
Clock12W01,Wall Clock Thermometer Antique Modern Design,,,,,,,"{sku:'Clock12W01',title:'Clock12W01 Wall Clock Thermometer Antique Modern Design',weight:,l:,w:,h:},"
PHA-Manual-9m,9M Swimming pool vacuum cleaner hose with end cuffs- Manual,2.3,50,48,15,,,"{sku:'PHA-Manual-9m',title:'PHA-Manual-9m 9M Swimming pool vacuum cleaner hose with end cuffs- Manual',weight:2.3,l:50,w:48,h:15},"
PHA-Manual-12m,12M Swimming pool vacuum cleaner hose with end cuffs- Manual,3,53,51,19,,,"{sku:'PHA-Manual-12m',title:'PHA-Manual-12m 12M Swimming pool vacuum cleaner hose with end cuffs- Manual',weight:3,l:53,w:51,h:19},"
PHA-Manual-15m,15M Swimming pool vacuum cleaner hose with end cuffs- Manual,3.7,51,51,25,,,"{sku:'PHA-Manual-15m',title:'PHA-Manual-15m 15M Swimming pool vacuum cleaner hose with end cuffs- Manual',weight:3.7,l:51,w:51,h:25},"
DBL-PAN-36cm,36cm Double Pan Cook Frying Pan,2,46,36,8,,,"{sku:'DBL-PAN-36cm',title:'DBL-PAN-36cm 36cm Double Pan Cook Frying Pan',weight:2,l:46,w:36,h:8},"
WB-NB--90x180,Mobile Whiteboard Magnetic Marker White Board | 90x180cm,,,,,,,"{sku:'WB-NB--90x180',title:'WB-NB--90x180 Mobile Whiteboard Magnetic Marker White Board | 90x180cm',weight:,l:,w:,h:},"
Piano-XY-613,Piano Keyboard Organ Electronic 61 Keys,,,,,,,"{sku:'Piano-XY-613',title:'Piano-XY-613 Piano Keyboard Organ Electronic 61 Keys',weight:,l:,w:,h:},"
Soup_Maker,Superchef Soup Maker Blender,,,,,,,"{sku:'Soup_Maker',title:'Soup_Maker Superchef Soup Maker Blender',weight:,l:,w:,h:},"
Clock-14B-black,Nova Clock Metal Number Casing Modern Designer Quartz - Black,2.1,40,36,7,,,"{sku:'Clock-14B-black',title:'Clock-14B-black Nova Clock Metal Number Casing Modern Designer Quartz - Black',weight:2.1,l:40,w:36,h:7},"
Clock-14B-white,Nova Clock Metal Number Casing Modern Designer Quartz - White,2.1,40,36,7,,,"{sku:'Clock-14B-white',title:'Clock-14B-white Nova Clock Metal Number Casing Modern Designer Quartz - White',weight:2.1,l:40,w:36,h:7},"
Clock-N12608,Eiffel Wall Clock Metal Casing Vintage Design,2.9,41,41,18,,,"{sku:'Clock-N12608',title:'Clock-N12608 Eiffel Wall Clock Metal Casing Vintage Design',weight:2.9,l:41,w:41,h:18},"
Clock-510,Wall Clock Steel Modern Design Quartz,2.3,36,36,70,,,"{sku:'Clock-510',title:'Clock-510 Wall Clock Steel Modern Design Quartz',weight:2.3,l:36,w:36,h:70},"
AngryBirdClock-I1209,Quartz Angry Birds Children Wall Clock Decoration,2.3,36,36,70,,,"{sku:'AngryBirdClock-I1209',title:'AngryBirdClock-I1209 Quartz Angry Birds Children Wall Clock Decoration',weight:2.3,l:36,w:36,h:70},"
Ice-B-Chairs-Set,2 x Folding Chairs Padded Camping Picnic Arm Foldable Chair,8.3,95,20,35,,,"{sku:'Ice-B-Chairs-Set',title:'Ice-B-Chairs-Set 2 x Folding Chairs Padded Camping Picnic Arm Foldable Chair',weight:8.3,l:95,w:20,h:35},"
PSSL03-3,Above Ground Swimming Pool Ladder 4 Steps,,,,,,,"{sku:'PSSL03-3',title:'PSSL03-3 Above Ground Swimming Pool Ladder 4 Steps',weight:,l:,w:,h:},"
Uni-RED-26-Inch,Fun Unicycle Circus Bike 26-Inch Red,6.1,65,19,67,,,"{sku:'Uni-RED-26-Inch',title:'Uni-RED-26-Inch Fun Unicycle Circus Bike 26-Inch Red',weight:6.1,l:65,w:19,h:67},"
LazyLounge-Green,Green Fast Inflatable Sofa Lounge,1.2,40,25,5.5,,,"{sku:'LazyLounge-Green',title:'LazyLounge-Green Green Fast Inflatable Sofa Lounge',weight:1.2,l:40,w:25,h:5.5},"
LazyLounge-Purple,Purple Fast Inflatable Sofa Lounge,1.2,40,25,5.5,,,"{sku:'LazyLounge-Purple',title:'LazyLounge-Purple Purple Fast Inflatable Sofa Lounge',weight:1.2,l:40,w:25,h:5.5},"
LazyLounge-blue,Blue Fast Inflatable Sofa Lounge,1.2,40,25,5.5,,,"{sku:'LazyLounge-blue',title:'LazyLounge-blue Blue Fast Inflatable Sofa Lounge',weight:1.2,l:40,w:25,h:5.5},"
LazyLounge-Red,Red Fast Inflatable Sofa Lounge,1.2,40,25,5.5,,,"{sku:'LazyLounge-Red',title:'LazyLounge-Red Red Fast Inflatable Sofa Lounge',weight:1.2,l:40,w:25,h:5.5},"
Steamer-ZGFF-28cm,Stainless Steel Steamer Pot 4 Layers - 28cm,4.3,38,35,32,,,"{sku:'Steamer-ZGFF-28cm',title:'Steamer-ZGFF-28cm Stainless Steel Steamer Pot 4 Layers - 28cm',weight:4.3,l:38,w:35,h:32},"
Steamer-ZGFF-32cm,Stainless Steel Steamer Pot 4 Layers - 32cm,5.4,40,31,36,,,"{sku:'Steamer-ZGFF-32cm',title:'Steamer-ZGFF-32cm Stainless Steel Steamer Pot 4 Layers - 32cm',weight:5.4,l:40,w:31,h:36},"
Steamer-ZGFF-36cm,Stainless Steel Steamer Pot 4 Layers - 36cm,6.3,41,37,30,,,"{sku:'Steamer-ZGFF-36cm',title:'Steamer-ZGFF-36cm Stainless Steel Steamer Pot 4 Layers - 36cm',weight:6.3,l:41,w:37,h:30},"
Steamer-FF-28cm,Stainless Steel Steamer Pot 2 Layers - 28cm,2.1,35,20,30,,,"{sku:'Steamer-FF-28cm',title:'Steamer-FF-28cm Stainless Steel Steamer Pot 2 Layers - 28cm',weight:2.1,l:35,w:20,h:30},"
Steamer-FF-32cm,Stainless Steel Steamer Pot 2 Layers - 32cm,2.7,38,22,34,,,"{sku:'Steamer-FF-32cm',title:'Steamer-FF-32cm Stainless Steel Steamer Pot 2 Layers - 32cm',weight:2.7,l:38,w:22,h:34},"
SPEED-BALL-87035,Free Standing Speed ball Training Boxing Punch Speed Ball Stand,,,,,,,"{sku:'SPEED-BALL-87035',title:'SPEED-BALL-87035 Free Standing Speed ball Training Boxing Punch Speed Ball Stand',weight:,l:,w:,h:},"
HG-02-GRILL,SuperChef Electric Power Smokeless Grill BBQ Smoke Indoor w/ Fan Extractor 1500w,5.7,54,19,37,,,"{sku:'HG-02-GRILL',title:'HG-02-GRILL SuperChef Electric Power Smokeless Grill BBQ Smoke Indoor w/ Fan Extractor 1500w',weight:5.7,l:54,w:19,h:37},"
PHA-AUTO-9m,9M Swimming pool vacuum cleaner hose with end cuffs- Automatic,3.7,64,60,16,,,"{sku:'PHA-AUTO-9m',title:'PHA-AUTO-9m 9M Swimming pool vacuum cleaner hose with end cuffs- Automatic',weight:3.7,l:64,w:60,h:16},"
PHA-AUTO-12m,12M Swimming pool vacuum cleaner hose with end cuffs- Automatic,2.3,60,64,14,,,"{sku:'PHA-AUTO-12m',title:'PHA-AUTO-12m 12M Swimming pool vacuum cleaner hose with end cuffs- Automatic',weight:2.3,l:60,w:64,h:14},"
PHA-AUTO-15m,15M Swimming pool vacuum cleaner hose with end cuffs- Automatic,3.9,64,60,20,,,"{sku:'PHA-AUTO-15m',title:'PHA-AUTO-15m 15M Swimming pool vacuum cleaner hose with end cuffs- Automatic',weight:3.9,l:64,w:60,h:20},"
HZA-9901,Portable Stainless Steel BBQ Charcoal Wood,6.2,72,19,32.5,,,"{sku:'HZA-9901',title:'HZA-9901 Portable Stainless Steel BBQ Charcoal Wood',weight:6.2,l:72,w:19,h:32.5},"
Clock-14701,Brixton Clock Black Metal Casing Home Decor,2,42,41,11,,,"{sku:'Clock-14701',title:'Clock-14701 Brixton Clock Black Metal Casing Home Decor',weight:2,l:42,w:41,h:11},"
AquaLife-100L,100L Fish Tank Aquarium Curved Glass Filter Pump Light,17.6,74,47,64,,,"{sku:'AquaLife-100L',title:'AquaLife-100L 100L Fish Tank Aquarium Curved Glass Filter Pump Light',weight:17.6,l:74,w:47,h:64},"
AquaLife-10L,10L Fish Tank Aquarium Curved Glass Filter Cabinet Stand Pump Light,2.8,31.5,23.5,34,,,"{sku:'AquaLife-10L',title:'AquaLife-10L 10L Fish Tank Aquarium Curved Glass Filter Cabinet Stand Pump Light',weight:2.8,l:31.5,w:23.5,h:34},"
AquaLife-35L,35L Fish Tank Aquarium Curved Glass Filter Pump Light,,,,,,,"{sku:'AquaLife-35L',title:'AquaLife-35L 35L Fish Tank Aquarium Curved Glass Filter Pump Light',weight:,l:,w:,h:},"
AquaLife-35L-tank-cabinet,35L Fish Tank Aquarium Curved Glass Filter Pump Light WithCabinet Stand,,,,,,,"{sku:'AquaLife-35L-tank-cabinet',title:'AquaLife-35L-tank-cabinet 35L Fish Tank Aquarium Curved Glass Filter Pump Light WithCabinet Stand',weight:,l:,w:,h:},"
AquaLife-70L,70L Fish Tank Aquarium Curved Glass Filter Pump Light,13.9,42,62,63,,,"{sku:'AquaLife-70L',title:'AquaLife-70L 70L Fish Tank Aquarium Curved Glass Filter Pump Light',weight:13.9,l:42,w:62,h:63},"
AquaLife-S400-cabinet,Fish Tank Aquarium Cabinet Stand - 390 x 240 x 625 mm,10.3,76,50,10,,,"{sku:'AquaLife-S400-cabinet',title:'AquaLife-S400-cabinet Fish Tank Aquarium Cabinet Stand - 390 x 240 x 625 mm',weight:10.3,l:76,w:50,h:10},"
AquaLife-S600-cabinet,Fish Tank Aquarium Cabinet Stand - 610 x 335 x 625 mm,,,,,,,"{sku:'AquaLife-S600-cabinet',title:'AquaLife-S600-cabinet Fish Tank Aquarium Cabinet Stand - 610 x 335 x 625 mm',weight:,l:,w:,h:},"
AquaLife-100L-tank-cabinet,100L Fish Tank & Cabinet Stand Aquarium Curved Glass Filter Pump Light ,,,,,,,"{sku:'AquaLife-100L-tank-cabinet',title:'AquaLife-100L-tank-cabinet 100L Fish Tank & Cabinet Stand Aquarium Curved Glass Filter Pump Light ',weight:,l:,w:,h:},"
WB-NB--120x180,Mobile Whiteboard Magnetic Marker White Board | 120x180cm,,,,,,,"{sku:'WB-NB--120x180',title:'WB-NB--120x180 Mobile Whiteboard Magnetic Marker White Board | 120x180cm',weight:,l:,w:,h:},"
pressure-cooker-11L,11L Pressure Cooker Stainless Steel - Commercial Grade,,,,,,,"{sku:'pressure-cooker-11L',title:'pressure-cooker-11L 11L Pressure Cooker Stainless Steel - Commercial Grade',weight:,l:,w:,h:},"
DBL-PAN-40cm,40cm Double Pan Cook Frying Pan,,,,,,,"{sku:'DBL-PAN-40cm',title:'DBL-PAN-40cm 40cm Double Pan Cook Frying Pan',weight:,l:,w:,h:},"
pressure-cooker-6L,6L Pressure Cooker Stainless Steel - Commercial Grade,4.2,46,27,26,,,"{sku:'pressure-cooker-6L',title:'pressure-cooker-6L 6L Pressure Cooker Stainless Steel - Commercial Grade',weight:4.2,l:46,w:27,h:26},"
pressure-cooker-9L,9L Pressure Cooker Stainless Steel - Commercial Grade,5.7,,,,,,"{sku:'pressure-cooker-9L',title:'pressure-cooker-9L 9L Pressure Cooker Stainless Steel - Commercial Grade',weight:5.7,l:,w:,h:},"
BP-1816-black,Travel Backpack Laptop Hiking Rucksack - Black,0.8,47,38,9,,,"{sku:'BP-1816-black',title:'BP-1816-black Travel Backpack Laptop Hiking Rucksack - Black',weight:0.8,l:47,w:38,h:9},"
BP-1816-orange,Travel Backpack Laptop Hiking Rucksack - Orange,0.8,47,38,9,,,"{sku:'BP-1816-orange',title:'BP-1816-orange Travel Backpack Laptop Hiking Rucksack - Orange',weight:0.8,l:47,w:38,h:9},"
BP-1816-red,Travel Backpack Laptop Hiking Rucksack - Red,0.8,47,38,9,,,"{sku:'BP-1816-red',title:'BP-1816-red Travel Backpack Laptop Hiking Rucksack - Red',weight:0.8,l:47,w:38,h:9},"
BP-1816-blue,Travel Backpack Laptop Hiking Rucksack -Blue,0.8,47,38,9,,,"{sku:'BP-1816-blue',title:'BP-1816-blue Travel Backpack Laptop Hiking Rucksack -Blue',weight:0.8,l:47,w:38,h:9},"
BBQ-HZA8805,Portable Stainless Steel BBQ Charcoal Grill,4.2,64,33,13,,,"{sku:'BBQ-HZA8805',title:'BBQ-HZA8805 Portable Stainless Steel BBQ Charcoal Grill',weight:4.2,l:64,w:33,h:13},"
HZA29,BBQ Charcoal Grill Portable Stainless Steel,2.3,44,31,7.5,,,"{sku:'HZA29',title:'HZA29 BBQ Charcoal Grill Portable Stainless Steel',weight:2.3,l:44,w:31,h:7.5},"
PSSL03-2,Above Ground Swimming Pool Ladder 3 Steps,6.8,41,13,70,,,"{sku:'PSSL03-2',title:'PSSL03-2 Above Ground Swimming Pool Ladder 3 Steps',weight:6.8,l:41,w:13,h:70},"
Clock-400,Wall Clock Chrome Vintage Retro Quartz Modern 40cm,3.5,51,47,18,,,"{sku:'Clock-400',title:'Clock-400 Wall Clock Chrome Vintage Retro Quartz Modern 40cm',weight:3.5,l:51,w:47,h:18},"
Royce-sb-1000,Royce Hammer Drill ToolsProfessional 1000w13mm,2.3,29,27,8,,,"{sku:'Royce-sb-1000',title:'Royce-sb-1000 Royce Hammer Drill ToolsProfessional 1000w13mm',weight:2.3,l:29,w:27,h:8},"
Clock-16420-Roman,Roman Numeral Wall Clock Metal Casing Quartz,2.7,44,43,8.5,,,"{sku:'Clock-16420-Roman',title:'Clock-16420-Roman Roman Numeral Wall Clock Metal Casing Quartz',weight:2.7,l:44,w:43,h:8.5},"
PL6018,Wall Clock Aluminium Casing Home Decor Design Quartz,,,,,,,"{sku:'PL6018',title:'PL6018 Wall Clock Aluminium Casing Home Decor Design Quartz',weight:,l:,w:,h:},"
Ankle_Weight-4kg,4kg Ankle Weight Wrist Power Strap Exercise,4.5,35,18,9,,,"{sku:'Ankle_Weight-4kg',title:'Ankle_Weight-4kg 4kg Ankle Weight Wrist Power Strap Exercise',weight:4.5,l:35,w:18,h:9},"
Ankle_Weight-6kg,6kg Ankle Weight Wrist Power Strap Exercise,6.5,36,19,10,,,"{sku:'Ankle_Weight-6kg',title:'Ankle_Weight-6kg 6kg Ankle Weight Wrist Power Strap Exercise',weight:6.5,l:36,w:19,h:10},"
ab-Wonder-Core-04,Ab Six Pack Crunch Sit Up Bench,5.7,56,14,49,,,"{sku:'ab-Wonder-Core-04',title:'ab-Wonder-Core-04 Ab Six Pack Crunch Sit Up Bench',weight:5.7,l:56,w:14,h:49},"
XTS-661,Electronic Piano Keyboard Organ 61 Key,,,,,,,"{sku:'XTS-661',title:'XTS-661 Electronic Piano Keyboard Organ 61 Key',weight:,l:,w:,h:},"
Uni-Red-24-Inch,Fun Unicycle Circus Bike 24 Inch Red,5.8,61,19,62,,,"{sku:'Uni-Red-24-Inch',title:'Uni-Red-24-Inch Fun Unicycle Circus Bike 24 Inch Red',weight:5.8,l:61,w:19,h:62},"
Scale-40Kg,Price Weight Computing Digital Electronic Scale 40KGs,3.3,38,14,36,,,"{sku:'Scale-40Kg',title:'Scale-40Kg Price Weight Computing Digital Electronic Scale 40KGs',weight:3.3,l:38,w:14,h:36},"
CCTV-420TVL,12mm Lens CCTV Security Camera Weatherproof,,,,,,,"{sku:'CCTV-420TVL',title:'CCTV-420TVL 12mm Lens CCTV Security Camera Weatherproof',weight:,l:,w:,h:},"
L-STEAMER-36,36cm Stainless Steel Steamer | XL Large Commercial Steam Pot,6.3,38,39,61,,,"{sku:'L-STEAMER-36',title:'L-STEAMER-36 36cm Stainless Steel Steamer | XL Large Commercial Steam Pot',weight:6.3,l:38,w:39,h:61},"
L-STEAMER-40,40cm Stainless Steel Steamer | XL Large Commercial Steam Pot,,,,,,,"{sku:'L-STEAMER-40',title:'L-STEAMER-40 40cm Stainless Steel Steamer | XL Large Commercial Steam Pot',weight:,l:,w:,h:},"
L-STEAMER-47,47cm Stainless Steel Steamer | XL Large Commercial Steam Pot,17.7,50,51,70,,,"{sku:'L-STEAMER-47',title:'L-STEAMER-47 47cm Stainless Steel Steamer | XL Large Commercial Steam Pot',weight:17.7,l:50,w:51,h:70},"
L-STEAMER-52,52cm Stainless Steel Steamer | XL Large Commercial Steam Pot,12,55,54,75,,,"{sku:'L-STEAMER-52',title:'L-STEAMER-52 52cm Stainless Steel Steamer | XL Large Commercial Steam Pot',weight:12,l:55,w:54,h:75},"
CCTV-860HCH,6mm Lens CCTV Security Camera Weatherproof,0.62,26,12,70,,,"{sku:'CCTV-860HCH',title:'CCTV-860HCH 6mm Lens CCTV Security Camera Weatherproof',weight:0.62,l:26,w:12,h:70},"
BackStretcher,Back Stretcher Orthopedic Massager,0.8,59,20,4.5,,,"{sku:'BackStretcher',title:'BackStretcher Back Stretcher Orthopedic Massager',weight:0.8,l:59,w:20,h:4.5},"
Tool-W0329B,Double Ring Offset Wrench Spanner Tool Set - 12PCS,,,,,,,"{sku:'Tool-W0329B',title:'Tool-W0329B Double Ring Offset Wrench Spanner Tool Set - 12PCS',weight:,l:,w:,h:},"
Dumbbell-W,Dumbbell Fitness Shake Weight Workout - Women,,,,,,,"{sku:'Dumbbell-W',title:'Dumbbell-W Dumbbell Fitness Shake Weight Workout - Women',weight:,l:,w:,h:},"
Dumbbell-M,Dumbbell Fitness Shake Weight Workout -Men,1.9,36,12.5,12,,,"{sku:'Dumbbell-M',title:'Dumbbell-M Dumbbell Fitness Shake Weight Workout -Men',weight:1.9,l:36,w:12.5,h:12},"
NLW9020-Trolley,Folding Aluminium Trolley Heavy Duty 100kg,5.2,42,14,75,,,"{sku:'NLW9020-Trolley',title:'NLW9020-Trolley Folding Aluminium Trolley Heavy Duty 100kg',weight:5.2,l:42,w:14,h:75},"
NE-YLR0.044TS,Water Dispenser Cooler Hot & Cold Water,9.4,35,35,100,,,"{sku:'NE-YLR0.044TS',title:'NE-YLR0.044TS Water Dispenser Cooler Hot & Cold Water',weight:9.4,l:35,w:35,h:100},"
JEK-08,Water Dispenser Bottle Filter | Purifier,2.6,29,29,43,,,"{sku:'JEK-08',title:'JEK-08 Water Dispenser Bottle Filter | Purifier',weight:2.6,l:29,w:29,h:43},"
flipchart-DS6090,FlipChart Magnetic Adjustable White Board,,,,,,,"{sku:'flipchart-DS6090',title:'flipchart-DS6090 FlipChart Magnetic Adjustable White Board',weight:,l:,w:,h:},"
BBQ-HZA8803,Foldable Stainless Steel Charcoal BBQ Grill,4.3,32,18,73,,,"{sku:'BBQ-HZA8803',title:'BBQ-HZA8803 Foldable Stainless Steel Charcoal BBQ Grill',weight:4.3,l:32,w:18,h:73},"
PWS02,Pool Wall Skimmer Wide Mouth Liner,3.1,22.5,36,34.5,,,"{sku:'PWS02',title:'PWS02 Pool Wall Skimmer Wide Mouth Liner',weight:3.1,l:22.5,w:36,h:34.5},"
BBQ-1018,Stainless Steel BBQ Charcoal Grill,3.4,40,29,28,,,"{sku:'BBQ-1018',title:'BBQ-1018 Stainless Steel BBQ Charcoal Grill',weight:3.4,l:40,w:29,h:28},"
FOLDING-CHAIR-037-Red,2 x Folding Office Chairs Padded Camping Picnic Arm Foldable Chair - Red,5.9,20.5,11,93,,,"{sku:'FOLDING-CHAIR-037-Red',title:'FOLDING-CHAIR-037-Red 2 x Folding Office Chairs Padded Camping Picnic Arm Foldable Chair - Red',weight:5.9,l:20.5,w:11,h:93},"
FOLDING-CHAIR-037-Blue,2 x Folding Office Chairs Padded Camping Picnic Arm Foldable Chair - Blue,5.9,20.5,11,93,,,"{sku:'FOLDING-CHAIR-037-Blue',title:'FOLDING-CHAIR-037-Blue 2 x Folding Office Chairs Padded Camping Picnic Arm Foldable Chair - Blue',weight:5.9,l:20.5,w:11,h:93},"
Chess-3in1,3 in1 Magnetic Travel Game Chess Set,1.5,41,21,6,,,"{sku:'Chess-3in1',title:'Chess-3in1 3 in1 Magnetic Travel Game Chess Set',weight:1.5,l:41,w:21,h:6},"
AIRPOT-4L,4L Airpot Thermos Stainless Steel Vacuum Flask Insulated Pump Pot,,,,,,,"{sku:'AIRPOT-4L',title:'AIRPOT-4L 4L Airpot Thermos Stainless Steel Vacuum Flask Insulated Pump Pot',weight:,l:,w:,h:},"
Chess-5in1,5 in1 Magnetic Travel Game Chess Set,1.5,25,33,7,,,"{sku:'Chess-5in1',title:'Chess-5in1 5 in1 Magnetic Travel Game Chess Set',weight:1.5,l:25,w:33,h:7},"
BP-Army-90L-Green,Army Style Camping Hiking Mountain Back Pack - Green,2.9,38,4,79,,,"{sku:'BP-Army-90L-Green',title:'BP-Army-90L-Green Army Style Camping Hiking Mountain Back Pack - Green',weight:2.9,l:38,w:4,h:79},"
BP-Army-90L-Grey,Army Style Camping Hiking Mountain Back Pack - Grey,2.9,38,4,79,,,"{sku:'BP-Army-90L-Grey',title:'BP-Army-90L-Grey Army Style Camping Hiking Mountain Back Pack - Grey',weight:2.9,l:38,w:4,h:79},"
Beer-Tower,Beer Tower Dispenser Tap - 3L,2.2,20,20,84,,,"{sku:'Beer-Tower',title:'Beer-Tower Beer Tower Dispenser Tap - 3L',weight:2.2,l:20,w:20,h:84},"
BP-90L-blue,Camping Hiking Mountain Travel Backpacks 90L - Blue,2.9,38,4,79,,,"{sku:'BP-90L-blue',title:'BP-90L-blue Camping Hiking Mountain Travel Backpacks 90L - Blue',weight:2.9,l:38,w:4,h:79},"
StickyTape-36,Clear Packaging Tape Adhesive Sticky Tapes 48mm 75M - 36 pcs,5.9,32,22,30,,,"{sku:'StickyTape-36',title:'StickyTape-36 Clear Packaging Tape Adhesive Sticky Tapes 48mm 75M - 36 pcs',weight:5.9,l:32,w:22,h:30},"
StickyTape-72,Clear Packaging Tape Adhesive Sticky Tapes 48mm 75M - 72 pcs,11.7,42,32,30,,,"{sku:'StickyTape-72',title:'StickyTape-72 Clear Packaging Tape Adhesive Sticky Tapes 48mm 75M - 72 pcs',weight:11.7,l:42,w:32,h:30},"
Trolley-160kg,Folding Aluminium Trolley 160kg,5.6,57,8,79,,,"{sku:'Trolley-160kg',title:'Trolley-160kg Folding Aluminium Trolley 160kg',weight:5.6,l:57,w:8,h:79},"
06006-BATHTUB-PINK,Folding Bath Tub - Newborn Baby |Toddler | Walker- Pink,,,,,,,"{sku:'06006-BATHTUB-PINK',title:'06006-BATHTUB-PINK Folding Bath Tub - Newborn Baby |Toddler | Walker- Pink',weight:,l:,w:,h:},"
POTATO-CHIPPER,French Fries Potatp Chipper Cutter,0.6,25,14,11,,,"{sku:'POTATO-CHIPPER',title:'POTATO-CHIPPER French Fries Potatp Chipper Cutter',weight:0.6,l:25,w:14,h:11},"
BBQ-round,Korean BBQ Plate Grill Pan Non Stick Marble Coated Round,1.2,37,35,6,,,"{sku:'BBQ-round',title:'BBQ-round Korean BBQ Plate Grill Pan Non Stick Marble Coated Round',weight:1.2,l:37,w:35,h:6},"
BBQ-square,Korean BBQ Plate Grill Pan Non Stick Marble CoatedSquare,1.2,37,35,6,,,"{sku:'BBQ-square',title:'BBQ-square Korean BBQ Plate Grill Pan Non Stick Marble CoatedSquare',weight:1.2,l:37,w:35,h:6},"
WB-NB--60x90,Mobile Whiteboard Magnetic Marker White Board | 60x90cm,8.6,68,10,137,,,"{sku:'WB-NB--60x90',title:'WB-NB--60x90 Mobile Whiteboard Magnetic Marker White Board | 60x90cm',weight:8.6,l:68,w:10,h:137},"
Tool-W0329A,Offset Wrench Tool Set - 8PCS,1.52,39,10,7,,,"{sku:'Tool-W0329A',title:'Tool-W0329A Offset Wrench Tool Set - 8PCS',weight:1.52,l:39,w:10,h:7},"
GB086L-CHESS-DRINK,Shot Glass Chess Drinking Game Set Large Board Drink Games,2.3,39,39,7,,,"{sku:'GB086L-CHESS-DRINK',title:'GB086L-CHESS-DRINK Shot Glass Chess Drinking Game Set Large Board Drink Games',weight:2.3,l:39,w:39,h:7},"
