PRODUCT_SKU,PRODUCT_TITLE,WEIGHT,LENGTH,WIDTH,HEIGHT,,,
SITUP-SCA2098,Sit Up Bench Press Multi Function Adjustable,,,,,,,"{sku:'SITUP-SCA2098',title:'SITUP-SCA2098 Sit Up Bench Press Multi Function Adjustable',weight:,l:,w:,h:},"
Tool-82pcs-Tools,Spanners Wrenches Sockets and Accessories Tool Set,7.1,44,34,8,,,"{sku:'Tool-82pcs-Tools',title:'Tool-82pcs-Tools Spanners Wrenches Sockets and Accessories Tool Set',weight:7.1,l:44,w:34,h:8},"
8pec-cookware,Stainless Steel Cookware Saucepot 4 sets,3.5,30,30,23,,,"{sku:'8pec-cookware',title:'8pec-cookware Stainless Steel Cookware Saucepot 4 sets',weight:3.5,l:30,w:30,h:23},"
Tool-W0327C,Wrench Spanner Tool Set Tool Set - 14PCS,2.3,39,10,7,,,"{sku:'Tool-W0327C',title:'Tool-W0327C Wrench Spanner Tool Set Tool Set - 14PCS',weight:2.3,l:39,w:10,h:7},"
EVO-T-Bags,Original EVO Shopping Trolley Bags,,,,,,,"{sku:'EVO-T-Bags',title:'EVO-T-Bags Original EVO Shopping Trolley Bags',weight:,l:,w:,h:},"
W0327D,Wrench Spanners Tool Set Chrome Vanadium Steel,3.5,48,13,8,,,"{sku:'W0327D',title:'W0327D Wrench Spanners Tool Set Chrome Vanadium Steel',weight:3.5,l:48,w:13,h:8},"
airfryer-black,Super Chef Air Fryer Rotary Rotating Rotisserie Convection Oven 12L - Black,,,,,,,"{sku:'airfryer-black',title:'airfryer-black Super Chef Air Fryer Rotary Rotating Rotisserie Convection Oven 12L - Black',weight:,l:,w:,h:},"
airfryer-white,Super Chef Air Fryer Rotary Rotating Rotisserie Convection Oven 12L - White,,,,,,,"{sku:'airfryer-white',title:'airfryer-white Super Chef Air Fryer Rotary Rotating Rotisserie Convection Oven 12L - White',weight:,l:,w:,h:},"
Unicycle-Red-16,Unicycle Circus Bike Black | Red - Small,4.6,38,18,41,,,"{sku:'Unicycle-Red-16',title:'Unicycle-Red-16 Unicycle Circus Bike Black | Red - Small',weight:4.6,l:38,w:18,h:41},"
YH-AC56-Compressor,Air Compressor Heavy Duty Tyre Inflator,6.4,40,25,24,,,"{sku:'YH-AC56-Compressor',title:'YH-AC56-Compressor Air Compressor Heavy Duty Tyre Inflator',weight:6.4,l:40,w:25,h:24},"
Cup-Holder,Dispenser Cup Holder Magnetic,0.4,41,10,19,,,"{sku:'Cup-Holder',title:'Cup-Holder Dispenser Cup Holder Magnetic',weight:0.4,l:41,w:10,h:19},"
PAC02,Auto Swimming Pool Cleaner Machine,6.5,86,18,52,,,"{sku:'PAC02',title:'PAC02 Auto Swimming Pool Cleaner Machine',weight:6.5,l:86,w:18,h:52},"
waterFilter_36L,Water Filter Purifier Anti Bacteria,4.9,58,38,38,,,"{sku:'waterFilter_36L',title:'waterFilter_36L Water Filter Purifier Anti Bacteria',weight:4.9,l:58,w:38,h:38},"
KHE-08 x 4,Auto Swimming Pool Vacuum Cleaner Hose 4 Pieces,,,,,,,"{sku:'KHE-08 x 4',title:'KHE-08 x 4 Auto Swimming Pool Vacuum Cleaner Hose 4 Pieces',weight:,l:,w:,h:},"
Clock-14411,Round Wall Clock Aluminium Modern Decor Silent Quartz,2,41,40,11,,,"{sku:'Clock-14411',title:'Clock-14411 Round Wall Clock Aluminium Modern Decor Silent Quartz',weight:2,l:41,w:40,h:11},"
SPIN_SCRUBBER,Spinning Scrubber Floor Brush Mop,1.4,56,23,9,,,"{sku:'SPIN_SCRUBBER',title:'SPIN_SCRUBBER Spinning Scrubber Floor Brush Mop',weight:1.4,l:56,w:23,h:9},"
2346-CHAFING-DISH,9L Bain Marie Chafing Dish Stainless Steel Food Warmer,,,,,,,"{sku:'2346-CHAFING-DISH',title:'2346-CHAFING-DISH 9L Bain Marie Chafing Dish Stainless Steel Food Warmer',weight:,l:,w:,h:},"
LED-Clock-green,LED Digital Clock Large - Green,2,58,26,8,,,"{sku:'LED-Clock-green',title:'LED-Clock-green LED Digital Clock Large - Green',weight:2,l:58,w:26,h:8},"
LED-Clock-blue,LED Digital Clock Large -Blue,2,58,26,8,,,"{sku:'LED-Clock-blue',title:'LED-Clock-blue LED Digital Clock Large -Blue',weight:2,l:58,w:26,h:8},"
LED-Clock-red,LED Digital Clock Large -Red,2,58,26,8,,,"{sku:'LED-Clock-red',title:'LED-Clock-red LED Digital Clock Large -Red',weight:2,l:58,w:26,h:8},"
FWAVE-M,Super Chef Oven Convection Micro Oven 17L,6.9,38,38,25,,,"{sku:'FWAVE-M',title:'FWAVE-M Super Chef Oven Convection Micro Oven 17L',weight:6.9,l:38,w:38,h:25},"
WaterFilter-10L,10L Water Filter Bottle Bench Top Dispenser Purifier 8 Stage Ceramic Carbon,,,,,,,"{sku:'WaterFilter-10L',title:'WaterFilter-10L 10L Water Filter Bottle Bench Top Dispenser Purifier 8 Stage Ceramic Carbon',weight:,l:,w:,h:},"
WaterFilter-14L,14L Water Filter Bottle Bench Top Dispenser Purifier 8 Stage Ceramic Carbon,2.6,29,29,25,,,"{sku:'WaterFilter-14L',title:'WaterFilter-14L 14L Water Filter Bottle Bench Top Dispenser Purifier 8 Stage Ceramic Carbon',weight:2.6,l:29,w:29,h:25},"
WaterFilter-21L,21LWater Filter Bottle Bench Top Dispenser Purifier 8 Stage Ceramic Carbon,3.8,32,21,31,,,"{sku:'WaterFilter-21L',title:'WaterFilter-21L 21LWater Filter Bottle Bench Top Dispenser Purifier 8 Stage Ceramic Carbon',weight:3.8,l:32,w:21,h:31},"
WaterFilter-24L,24L Water Filter Bottle Bench Top Dispenser Purifier 8 Stage Ceramic Carbon,3.8,36,27,39,,,"{sku:'WaterFilter-24L',title:'WaterFilter-24L 24L Water Filter Bottle Bench Top Dispenser Purifier 8 Stage Ceramic Carbon',weight:3.8,l:36,w:27,h:39},"
WaterFilter-28L,28L Water Filter Bottle Bench Top Dispenser Purifier 8 Stage Ceramic Carbon,5.1,37,35,26,,,"{sku:'WaterFilter-28L',title:'WaterFilter-28L 28L Water Filter Bottle Bench Top Dispenser Purifier 8 Stage Ceramic Carbon',weight:5.1,l:37,w:35,h:26},"
WaterFilter-32L,32L Water Filter Bottle Bench Top Dispenser Purifier 8 Stage Ceramic Carbon,4.1,35,35,29,,,"{sku:'WaterFilter-32L',title:'WaterFilter-32L 32L Water Filter Bottle Bench Top Dispenser Purifier 8 Stage Ceramic Carbon',weight:4.1,l:35,w:35,h:29},"
GrillPro,GrillPro Non-Stick Cast Aluminium BBQ Pan,1.3,51,27,3,,,"{sku:'GrillPro',title:'GrillPro GrillPro Non-Stick Cast Aluminium BBQ Pan',weight:1.3,l:51,w:27,h:3},"
INTEX-48259NP,Intex Inflatable Jumping Castle trampoline,12,56,17,42,,,"{sku:'INTEX-48259NP',title:'INTEX-48259NP Intex Inflatable Jumping Castle trampoline',weight:12,l:56,w:17,h:42},"
CF-10L,Replacement Carbon Filter for 10L Water Bottle Bench Top Dispenser Purifier,1.5,10,10,16,,,"{sku:'CF-10L',title:'CF-10L Replacement Carbon Filter for 10L Water Bottle Bench Top Dispenser Purifier',weight:1.5,l:10,w:10,h:16},"
CF-14L,Replacement Carbon Filter for 14L Water Bottle Bench Top Dispenser Purifier,1.5,10,10,16,,,"{sku:'CF-14L',title:'CF-14L Replacement Carbon Filter for 14L Water Bottle Bench Top Dispenser Purifier',weight:1.5,l:10,w:10,h:16},"
CF-21L,Replacement Carbon Filter for 21L Water Bottle Bench Top Dispenser Purifier,1.5,11,11,16,,,"{sku:'CF-21L',title:'CF-21L Replacement Carbon Filter for 21L Water Bottle Bench Top Dispenser Purifier',weight:1.5,l:11,w:11,h:16},"
CF-24L,Replacement Carbon Filter for 24L Water Bottle Bench Top Dispenser Purifier,1.5,11,11,16,,,"{sku:'CF-24L',title:'CF-24L Replacement Carbon Filter for 24L Water Bottle Bench Top Dispenser Purifier',weight:1.5,l:11,w:11,h:16},"
CF-28L,Replacement Carbon Filter for 28L Water Bottle Bench Top Dispenser Purifier,1.5,11,11,16,,,"{sku:'CF-28L',title:'CF-28L Replacement Carbon Filter for 28L Water Bottle Bench Top Dispenser Purifier',weight:1.5,l:11,w:11,h:16},"
CF-32L,Replacement Carbon Filter for 32L Water Bottle Bench Top Dispenser Purifier,1.5,11,11,16,,,"{sku:'CF-32L',title:'CF-32L Replacement Carbon Filter for 32L Water Bottle Bench Top Dispenser Purifier',weight:1.5,l:11,w:11,h:16},"
CMF-10L,Replacement Ceramic Filter for 10L Water Bottle Bench Top Dispenser Purifier,1.5,11,11,12,,,"{sku:'CMF-10L',title:'CMF-10L Replacement Ceramic Filter for 10L Water Bottle Bench Top Dispenser Purifier',weight:1.5,l:11,w:11,h:12},"
CMF-14L,Replacement Ceramic Filter for 14L Water Bottle Bench Top Dispenser Purifier,1.5,12,11,12,,,"{sku:'CMF-14L',title:'CMF-14L Replacement Ceramic Filter for 14L Water Bottle Bench Top Dispenser Purifier',weight:1.5,l:12,w:11,h:12},"
CMF-21L,Replacement Ceramic Filter for 21L Water Bottle Bench Top Dispenser Purifier,1.5,12,11,12,,,"{sku:'CMF-21L',title:'CMF-21L Replacement Ceramic Filter for 21L Water Bottle Bench Top Dispenser Purifier',weight:1.5,l:12,w:11,h:12},"
CMF-24L,Replacement Ceramic Filter for 24L Water Bottle Bench Top Dispenser Purifier,1.5,12,11,12,,,"{sku:'CMF-24L',title:'CMF-24L Replacement Ceramic Filter for 24L Water Bottle Bench Top Dispenser Purifier',weight:1.5,l:12,w:11,h:12},"
CMF-28L,Replacement Ceramic Filter for 28L Water Bottle Bench Top Dispenser Purifier,1.5,12,11,12,,,"{sku:'CMF-28L',title:'CMF-28L Replacement Ceramic Filter for 28L Water Bottle Bench Top Dispenser Purifier',weight:1.5,l:12,w:11,h:12},"
CMF-32L,Replacement Ceramic Filter for 32L Water Bottle Bench Top Dispenser Purifier,1.5,12,11,12,,,"{sku:'CMF-32L',title:'CMF-32L Replacement Ceramic Filter for 32L Water Bottle Bench Top Dispenser Purifier',weight:1.5,l:12,w:11,h:12},"
dicer-fusion,Dicer fuson,2,32,18,18,,,"{sku:'dicer-fusion',title:'dicer-fusion Dicer fuson',weight:2,l:32,w:18,h:18},"
